{
  "schema": "hatchwatch.people",
  "version": 1,
  "people": [
    {
      "id": "person-1",
      "points": [
        [
          2,
          10.36,
          4.806
        ],
        [
          2.25,
          10.125,
          4.498
        ],
        [
          2.5,
          9.72,
          4.55
        ],
        [
          2.75,
          9.258,
          4.436
        ],
        [
          3,
          9.013,
          4.456
        ],
        [
          3.25,
          8.883,
          4.253
        ],
        [
          3.5,
          8.393,
          4.186
        ],
        [
          3.75,
          8.01,
          3.928
        ],
        [
          4,
          7.742,
          4.068
        ],
        [
          4.25,
          7.54,
          3.869
        ],
        [
          4.5,
          7.111,
          3.793
        ],
        [
          4.75,
          6.783,
          3.653
        ],
        [
          5,
          6.43,
          3.704
        ],
        [
          5.25,
          6.226,
          3.492
        ],
        [
          5.5,
          5.793,
          3.422
        ],
        [
          5.75,
          5.469,
          3.282
        ],
        [
          6,
          5.126,
          3.322
        ],
        [
          6.25,
          4.91,
          3.107
        ],
        [
          6.5,
          4.476,
          3.041
        ],
        [
          6.75,
          4.16,
          2.909
        ],
        [
          7,
          3.837,
          2.96
        ],
        [
          7.25,
          3.603,
          2.73
        ],
        [
          7.5,
          3.141,
          2.695
        ],
        [
          7.75,
          2.826,
          2.561
        ],
        [
          8,
          2.499,
          2.612
        ],
        [
          8.25,
          2.276,
          2.322
        ],
        [
          8.5,
          1.844,
          2.322
        ],
        [
          8.75,
          1.522,
          2.167
        ],
        [
          9,
          1.206,
          2.203
        ],
        [
          9.25,
          1.111,
          1.782
        ],
        [
          9.5,
          0.523,
          1.969
        ],
        [
          9.75,
          0.186,
          1.796
        ],
        [
          10,
          -0.098,
          1.863
        ],
        [
          10.25,
          -0.339,
          1.743
        ],
        [
          10.5,
          -0.756,
          1.598
        ],
        [
          10.75,
          -1.132,
          1.433
        ],
        [
          11,
          -1.414,
          1.495
        ],
        [
          11.25,
          -1.569,
          1.111
        ],
        [
          11.5,
          -2.067,
          1.234
        ],
        [
          11.75,
          -2.346,
          1.015
        ],
        [
          12,
          -2.714,
          1.14
        ],
        [
          12.25,
          -3.002,
          0.974
        ],
        [
          12.5,
          -3.377,
          0.861
        ],
        [
          12.75,
          -3.724,
          0.608
        ],
        [
          13,
          -4.02,
          0.728
        ],
        [
          13.25,
          -4.404,
          0.652
        ],
        [
          13.5,
          -4.753,
          0.489
        ],
        [
          13.75,
          -5.047,
          0.282
        ],
        [
          14,
          -5.34,
          0.183
        ],
        [
          14.25,
          -5.623,
          0.229
        ],
        [
          14.5,
          -5.911,
          0.129
        ],
        [
          14.75,
          -6.597,
          -0.13
        ],
        [
          15,
          -6.495,
          0.058
        ],
        [
          15.25,
          -7.229,
          -0.385
        ],
        [
          15.5,
          -7.369,
          -0.306
        ],
        [
          15.75,
          -6.344,
          0.789
        ],
        [
          16,
          -7.03,
          0.376
        ],
        [
          16.25,
          -7.353,
          0.283
        ]
      ],
      "max_height_m": 1.98
    },
    {
      "id": "person-2",
      "points": [
        [
          2.5,
          -8.384,
          -7.942
        ],
        [
          2.75,
          -8.215,
          -7.494
        ],
        [
          3,
          -8.287,
          -7.223
        ],
        [
          3.25,
          -8.238,
          -6.815
        ],
        [
          3.5,
          -8.131,
          -6.628
        ],
        [
          3.75,
          -8.12,
          -6.259
        ],
        [
          4,
          -8.043,
          -5.862
        ],
        [
          4.25,
          -8.0,
          -5.497
        ],
        [
          4.5,
          -7.898,
          -5.216
        ],
        [
          4.75,
          -7.851,
          -4.972
        ],
        [
          5,
          -7.631,
          -4.486
        ],
        [
          5.5,
          -7.52,
          -3.813
        ],
        [
          5.75,
          -7.317,
          -3.451
        ],
        [
          6,
          -7.33,
          -2.996
        ],
        [
          6.25,
          -7.293,
          -2.707
        ],
        [
          6.5,
          -7.185,
          -2.476
        ],
        [
          6.75,
          -7.21,
          -2.246
        ],
        [
          7,
          -7.336,
          -1.813
        ],
        [
          7.25,
          -7.202,
          -1.501
        ],
        [
          7.5,
          -7.151,
          -1.317
        ],
        [
          7.75,
          -7.085,
          -0.981
        ],
        [
          8,
          -7.101,
          -0.63
        ],
        [
          8.25,
          -7.084,
          -0.208
        ],
        [
          8.5,
          -7.069,
          -0.133
        ],
        [
          8.75,
          -6.773,
          0.373
        ],
        [
          9,
          -6.715,
          0.628
        ],
        [
          9.25,
          -6.938,
          1.057
        ],
        [
          9.5,
          -6.905,
          1.247
        ],
        [
          11.75,
          -6.067,
          4.411
        ],
        [
          12,
          -5.875,
          4.738
        ],
        [
          12.25,
          -6.0,
          5.232
        ],
        [
          12.5,
          -5.924,
          5.503
        ],
        [
          12.75,
          -5.705,
          5.848
        ],
        [
          13,
          -5.818,
          6.054
        ],
        [
          13.25,
          -5.741,
          6.573
        ],
        [
          13.5,
          -5.681,
          6.869
        ],
        [
          13.75,
          -5.356,
          7.079
        ],
        [
          14,
          -5.579,
          7.387
        ],
        [
          14.25,
          -5.486,
          7.882
        ]
      ],
      "max_height_m": 2.84
    },
    {
      "id": "person-3",
      "points": [
        [
          15.625,
          -7.427,
          -2.356
        ],
        [
          15.875,
          -7.732,
          -1.21
        ],
        [
          16.125,
          -8.247,
          -0.487
        ],
        [
          16.375,
          -8.504,
          -0.461
        ],
        [
          16.625,
          -8.758,
          -0.663
        ],
        [
          16.875,
          -9.066,
          -1.042
        ],
        [
          17.125,
          -9.426,
          -0.864
        ],
        [
          17.375,
          -9.91,
          -1.208
        ],
        [
          17.625,
          -10.286,
          -0.31
        ],
        [
          17.875,
          -10.601,
          -0.655
        ],
        [
          18.125,
          -11.121,
          -1.511
        ],
        [
          18.375,
          -11.136,
          -1.359
        ],
        [
          18.5,
          -11.342,
          -1.477
        ]
      ],
      "max_height_m": 1.87
    },
    {
      "id": "person-4",
      "points": [
        [
          18.75,
          -10.21,
          -0.393
        ],
        [
          19,
          -10.582,
          -0.522
        ],
        [
          19.25,
          -10.818,
          -0.56
        ],
        [
          19.5,
          -10.789,
          -0.398
        ],
        [
          19.75,
          -10.892,
          -0.336
        ],
        [
          20,
          -11.416,
          -0.568
        ]
      ],
      "max_height_m": 2.02
    }
  ],
  "note": "Blind height-rule detections from public video; not identity, not intent. Very dark or low-contrast video is not supported; people may be missed."
}